{
  "$schema": "https://json-schema.org/draft/2020-12/schema",
  "$id": "https://urielmon.github.io/ai-fomo-radar/schema/issue.schema.json",
  "title": "AI FOMO Radar issue",
  "description": "One daily issue. scripts/build.mjs enforces this schema (plus date-window and file checks) and fails the build on any error.",
  "type": "object",
  "required": ["date", "issue_number", "window", "stories", "try_today"],
  "$defs": {
    "bi": {
      "type": "object",
      "required": ["en", "he"],
      "properties": { "en": { "type": "string", "minLength": 1 }, "he": { "type": "string", "minLength": 1 } },
      "additionalProperties": false
    },
    "published": {
      "description": "ISO 8601 date (YYYY-MM-DD) or date-time with zone (Z or ±HH:MM)",
      "type": "string",
      "pattern": "^\\d{4}-\\d{2}-\\d{2}(T\\d{2}:\\d{2}(:\\d{2}(\\.\\d+)?)?(Z|[+-]\\d{2}:\\d{2}))?$"
    },
    "url": { "type": "string", "pattern": "^https://" },
    "image": {
      "type": ["object", "null"],
      "required": ["src", "credit", "alt"],
      "properties": {
        "src": { "type": "string", "pattern": "^assets/img/\\d{4}-\\d{2}-\\d{2}/[^/]+\\.(jpg|jpeg|png|webp)$" },
        "credit": { "$ref": "#/$defs/bi" },
        "alt": { "$ref": "#/$defs/bi" }
      }
    },
    "link": {
      "type": "object",
      "required": ["label", "url"],
      "properties": { "label": { "$ref": "#/$defs/bi" }, "url": { "$ref": "#/$defs/url" } }
    }
  },
  "properties": {
    "date": { "type": "string", "pattern": "^\\d{4}-\\d{2}-\\d{2}$" },
    "issue_number": { "type": "integer", "minimum": 1 },
    "generated_at": { "type": "string" },
    "window": {
      "type": "object",
      "required": ["start", "end", "hours", "note"],
      "properties": {
        "start": { "type": "string" },
        "end": { "type": "string" },
        "hours": { "type": "integer", "minimum": 24, "maximum": 72 },
        "note": { "$ref": "#/$defs/bi" }
      }
    },
    "stories": {
      "type": "array",
      "minItems": 6,
      "maxItems": 10,
      "description": "Exactly one story must have lead: true",
      "items": {
        "type": "object",
        "required": ["id", "lead", "headline", "why", "url", "source", "published"],
        "properties": {
          "id": { "type": "string", "pattern": "^[a-z0-9-]+$" },
          "lead": { "type": "boolean" },
          "kicker": { "$ref": "#/$defs/bi" },
          "headline": { "$ref": "#/$defs/bi" },
          "why": { "$ref": "#/$defs/bi" },
          "url": { "$ref": "#/$defs/url" },
          "source": { "type": "string", "minLength": 1 },
          "published": { "$ref": "#/$defs/published" },
          "also": { "type": "array", "items": { "$ref": "#/$defs/link" } },
          "image": { "$ref": "#/$defs/image" }
        }
      }
    },
    "try_today": {
      "type": "array",
      "minItems": 1,
      "maxItems": 3,
      "items": {
        "type": "object",
        "required": ["id", "title", "body", "url", "source", "published"],
        "properties": {
          "id": { "type": "string", "pattern": "^[a-z0-9-]+$" },
          "title": { "$ref": "#/$defs/bi" },
          "body": { "$ref": "#/$defs/bi" },
          "url": { "$ref": "#/$defs/url" },
          "source": { "type": "string", "minLength": 1 },
          "published": { "$ref": "#/$defs/published" }
        }
      }
    }
  }
}
