{
  "date": "2026-10-11",
  "issue_number": 2,
  "generated_at": "2026-10-11T07:55:00+03:00",
  "window": {
    "start": "2026-10-09T07:45:00+03:00",
    "end": "2026-10-11T07:45:00+03:00",
    "hours": 48,
    "note": {
      "en": "It's the weekend, so the usual 24-hour window was thin. This issue covers 48 hours: Friday 9 Oct, 07:45 to Sunday 11 Oct, 07:45 (Israel time). Stories already in the previous issue are not repeated.",
      "he": "סוף שבוע, וחלון של 24 שעות יצא דליל. לכן הגיליון הזה מכסה 48 שעות: מיום שישי, 9 באוקטובר, 07:45, ועד יום ראשון, 11 באוקטובר, 07:45 (שעון ישראל). כתבות שכבר הופיעו בגיליון הקודם לא חוזרות כאן."
    }
  },
  "stories": [
    {
      "id": "personal-agent-protocol-draft",
      "lead": true,
      "kicker": {
        "en": "Personal agents",
        "he": "סוכנים אישיים"
      },
      "headline": {
        "en": "Meta and Sierra publish a first draft of 'Poppy', an open standard for how personal agents deal with businesses, with OpenAI, Visa and 33 more companies on board",
        "he": "Meta ו-Sierra מפרסמות טיוטה ראשונה של 'Poppy', תקן פתוח לאופן שבו סוכנים אישיים עובדים מול עסקים, ו-OpenAI, ‏Visa ועוד 33 חברות מצטרפות לתהליך"
      },
      "why": {
        "en": "Instead of an agent signing in as you and clicking through pages built for humans, a company publishes one file (`/.well-known/poppy.json`), the agent identifies itself, and you grant scoped access through OAuth, over the website, APIs (OpenAPI, MCP) or the company's own agent. If you want agents that book, return and renew things for you, this is the plumbing that lets them do it without impersonating you. It is a v0.1 draft under Apache 2.0, with workshops and a reference implementation promised within a month.",
        "he": "במקום שסוכן יתחבר בשמך וילחץ בין דפים שנבנו לבני אדם, החברה מפרסמת קובץ אחד (`/.well-known/poppy.json`), הסוכן מזדהה, ואתה נותן גישה מוגבלת דרך OAuth, מעל האתר, ממשקי API (‏OpenAPI, ‏MCP) או הסוכן של החברה עצמה. אם אתה רוצה סוכנים שמזמינים, מחזירים ומחדשים דברים בשבילך, זו התשתית שמאפשרת להם לעשות את זה בלי להתחזות אליך. זו טיוטת v0.1 ברישיון Apache 2.0, ובחודש הקרוב מובטחים סדנאות ומימוש ייחוס."
      },
      "url": "https://sierra.ai/blog/poppy",
      "source": "Sierra",
      "published": "2026-10-09T19:56:06Z",
      "also": [
        {
          "label": {
            "en": "Draft specification",
            "he": "הטיוטה של התקן"
          },
          "url": "https://personalagentprotocol.org/docs/spec"
        },
        {
          "label": {
            "en": "Announcement (Tuesday)",
            "he": "ההכרזה ביום שלישי"
          },
          "url": "https://sierra.ai/blog/introducing-personal-agent-protocol"
        }
      ],
      "image": {
        "src": "assets/img/2026-10-11/personal-agent-protocol.jpg",
        "credit": {
          "en": "Image: Sierra (header of the announcement post)",
          "he": "תמונה: Sierra (כותרת פוסט ההכרזה)"
        },
        "alt": {
          "en": "Header graphic of the Personal Agent Protocol post, listing the logos of Meta, Sierra, Stripe, Visa, OpenAI, Shopify and dozens of other partners",
          "he": "גרפיקת הכותרת של פוסט Personal Agent Protocol, עם הלוגואים של Meta, ‏Sierra, ‏Stripe, ‏Visa, ‏OpenAI, ‏Shopify ועשרות שותפים נוספים"
        }
      }
    },
    {
      "id": "chatgpt-dots-mobile-codex",
      "lead": false,
      "kicker": {
        "en": "Agent products",
        "he": "מוצרי סוכנים"
      },
      "headline": {
        "en": "ChatGPT 'dots', OpenAI's always-on agents, can now be created from your phone, and can start and continue Codex work",
        "he": "ה-'dots' של ChatGPT, סוכני ה-always-on של OpenAI, אפשר עכשיו ליצור מהטלפון, והם יודעים להפעיל ולהמשיך עבודה ב-Codex"
      },
      "why": {
        "en": "A dot has its own cloud computer and browser and keeps working when your devices are off. It can now open Codex tasks on a connected computer, continue existing local Codex threads and edit ChatGPT Work automations. Availability per OpenAI's docs: Pro users outside the EEA, UK and Switzerland, so Israel qualifies. Codex work a dot starts still counts against your Codex limits.",
        "he": "ל-dot יש מחשב ודפדפן משלו בענן, והוא ממשיך לעבוד גם כשהמכשירים שלך כבויים. עכשיו הוא יכול לפתוח משימות Codex במחשב מחובר, להמשיך שרשורי Codex מקומיים קיימים ולערוך אוטומציות של ChatGPT Work. הזמינות לפי התיעוד של OpenAI: מנויי Pro מחוץ ל-EEA, לבריטניה ולשווייץ, כלומר ישראל בפנים. עבודת Codex שה-dot מפעיל עדיין נספרת במכסות ה-Codex שלך."
      },
      "url": "https://learn.chatgpt.com/docs/whats-new/dots-october-9-2026",
      "source": "ChatGPT Learn (OpenAI)",
      "published": "2026-10-09",
      "also": [
        {
          "label": {
            "en": "Meet dots",
            "he": "הכירו את ה-dots"
          },
          "url": "https://learn.chatgpt.com/docs/dots"
        }
      ],
      "image": null
    },
    {
      "id": "claude-code-projects-waitlist",
      "lead": false,
      "kicker": {
        "en": "Claude Code",
        "he": "Claude Code"
      },
      "headline": {
        "en": "Anthropic lets every Pro and Max user on the Claude Code Projects waitlist in",
        "he": "Anthropic מכניסה את כל משתמשי Pro ו-Max מרשימת ההמתנה של Claude Code Projects"
      },
      "why": {
        "en": "A project is one coordinating chat that runs each task as its own parallel cloud thread, each on its own branch with tests and pull requests, and keeps going after you close the laptop. Steer it from your phone, but note the limits: threads burn plan usage fast, there is a cap of 200 new threads a day, cloud threads need GitHub.com repos, and running threads on your own machine is only promised 'very soon'.",
        "he": "פרויקט הוא צ'אט מתאם אחד שמריץ כל משימה כשרשור ענן מקביל משלה, כל אחד על ענף משלו עם בדיקות ו-pull requests, וממשיך לעבוד גם אחרי שסגרת את המחשב. אפשר לכוון אותו מהטלפון, אבל יש מגבלות: שרשורים שורפים את המכסה מהר, יש תקרה של 200 שרשורים חדשים ביום, שרשורי ענן דורשים מאגרי GitHub.com, וריצה של שרשורים על המחשב שלך מובטחת רק 'בקרוב מאוד'."
      },
      "url": "https://x.com/ClaudeDevs/status/2108621476538781878",
      "source": "X · @ClaudeDevs",
      "published": "2026-10-09T18:11:50Z",
      "also": [
        {
          "label": {
            "en": "Anthropic's launch post",
            "he": "פוסט ההשקה של Anthropic"
          },
          "url": "https://claude.com/blog/projects-redesigned"
        }
      ],
      "image": {
        "src": "assets/img/2026-10-11/claude-code-projects.jpg",
        "credit": {
          "en": "Image: Anthropic product screenshot, via The Verge (September launch coverage)",
          "he": "תמונה: צילום מסך של המוצר מאת Anthropic, באמצעות The Verge (סיקור ההשקה בספטמבר)"
        },
        "alt": {
          "en": "Screenshot of a Claude Code project: a coordinator chat on the left and a thread list with Waiting on you, Working and Idle on the right",
          "he": "צילום מסך של פרויקט ב-Claude Code: צ'אט מתאם משמאל, ורשימת שרשורים מימין לפי 'ממתין לך', 'בעבודה' ו'סרק'"
        }
      }
    },
    {
      "id": "github-copilot-local-sandboxing",
      "lead": false,
      "kicker": {
        "en": "Coding agents",
        "he": "סוכני קוד"
      },
      "headline": {
        "en": "GitHub Copilot's local sandboxing is generally available, and Copilot CLI can now find your local Ollama models",
        "he": "ארגז החול המקומי של GitHub Copilot זמין לכולם, וה-CLI של Copilot יודע עכשיו למצוא מודלי Ollama מקומיים"
      },
      "why": {
        "en": "Sandboxing limits what an agent can reach (files, network, credentials) in Copilot CLI, the Copilot app and VS Code Agent Host sessions, at no extra cost: a practical answer to this week's 'agents went off-script' stories. Typing `/model` now lists models from a running Ollama next to the cloud ones, and VS Code 1.141 shows agent sessions side by side.",
        "he": "ארגז החול מגביל למה סוכן יכול להגיע (קבצים, רשת, אישורי גישה) ב-Copilot CLI, באפליקציית Copilot ובסשנים של VS Code Agent Host, בלי תוספת תשלום: תשובה מעשית לכתבות של השבוע על סוכנים שחרגו מהתסריט. הפקודה `/model` מציגה עכשיו מודלים מ-Ollama שרץ אצלך לצד מודלי הענן, וב-VS Code 1.141 אפשר לראות סשנים של סוכנים זה לצד זה."
      },
      "url": "https://github.blog/changelog/2026-10-09-github-copilot-weekly-releases-october-5/",
      "source": "GitHub Changelog",
      "published": "2026-10-09T22:58:23Z",
      "also": [
        {
          "label": {
            "en": "Local sandboxing GA",
            "he": "ארגז החול המקומי זמין לכולם"
          },
          "url": "https://github.blog/changelog/2026-10-07-local-sandboxing-for-github-copilot-now-generally-available/"
        }
      ],
      "image": null
    },
    {
      "id": "elevenlabs-voice-detection-pap",
      "lead": false,
      "kicker": {
        "en": "Voice agents",
        "he": "סוכני קול"
      },
      "headline": {
        "en": "ElevenLabs adds synthetic-voice detection for agent phone calls and joins the Personal Agent Protocol group",
        "he": "ElevenLabs מוסיפה זיהוי קול סינתטי לשיחות טלפון של סוכנים, ומצטרפת לקבוצת Personal Agent Protocol"
      },
      "why": {
        "en": "More and more of the calls reaching businesses are personal agents or even cloned voices. The new detection tells human from AI in the first seconds of a call so a company can apply its own rules; it is enterprise-only for now, with a broader release promised later this month. If you ever let an agent phone a clinic or a support line for you, expect the other end to ask who is calling.",
        "he": "יותר ויותר שיחות שמגיעות לעסקים הן של סוכנים אישיים, ולפעמים אפילו של קול משוכפל. הזיהוי החדש מבדיל בין אדם ל-AI בשניות הראשונות של השיחה, כדי שהחברה תפעיל את הכללים שלה; כרגע זה רק ללקוחות Enterprise, ושחרור רחב יותר מובטח בהמשך החודש. אם אי פעם תבקש מסוכן להתקשר בשמך למרפאה או לשירות לקוחות, צפה שבצד השני ישאלו מי מתקשר."
      },